interaction_id,customer_id,interaction_type,interaction_date,notes
725,298,Meeting,2023-04-06 05:54:21.310417,Individual other without night cut husband college thank citizen themselves little join.
726,321,Chat,2023-03-21 05:50:22.364523,Age fast national where what wide nothing good billion direction manage third.
727,752,Chat,2023-01-28 11:09:18.417603,Project security term really kid also claim under hot late next.
728,688,Meeting,2023-01-23 18:51:24.206861,Happy artist law decide especially value media face environmental same final might.
729,689,Meeting,2020-12-14 19:21:19.528186,Answer report sell these management show population.
730,455,Meeting,2022-07-29 00:39:52.767857,Most likely into effect event trade leave run executive forward us art since.
731,519,Meeting,2024-01-10 01:36:10.924149,Yeah tax soon they out poor energy physical activity.
732,707,Phone Call,2023-09-17 02:22:11.563352,Edge world political probably couple employee base thus.
733,889,Phone Call,2020-04-10 04:18:50.030288,Live do difference hour few agent within language prove alone billion.
734,80,Phone Call,2022-06-17 22:50:37.822349,Executive serve piece job role control him voice woman building provide they.
735,724,Phone Call,2021-11-11 18:40:39.429052,Truth in bad around offer system appear world lay election bag.
736,459,Email,2021-10-23 16:44:44.380361,Data every mention per say simply.
737,787,Meeting,2021-08-18 03:37:49.887468,Green on Congress manage goal safe box baby may argue hope.
738,896,Email,2021-08-10 16:43:00.494786,Day require Mr shake region three.
739,176,Meeting,2022-01-08 11:13:01.328998,Water choice hope mother down gas individual situation.
740,530,Chat,2020-06-28 00:09:17.976166,Suddenly keep technology seat serve ready story raise because scene anything.
741,532,Chat,2021-03-21 00:03:32.849674,Under daughter also share laugh leg stop.
742,216,Phone Call,2022-04-04 19:52:34.127402,Arm area behind foot particular catch rock across management.
743,720,Chat,2020-09-01 22:14:12.415443,Position whom box home way popular very player race knowledge bad add.
744,427,Meeting,2024-03-12 21:26:03.022870,Seven ten idea full practice wrong class.
745,517,Chat,2021-01-24 01:20:46.769055,Weight short push argue happen bit only safe local.
746,584,Email,2021-06-03 00:00:20.883877,Career walk family fine without back should home character.
747,436,Chat,2023-08-12 03:47:25.924889,Member get purpose point investment quickly green own.
748,708,Meeting,2024-07-22 07:07:04.910728,Financial himself to important could happy worker answer market kind how rate meet.
749,157,Phone Call,2024-07-21 17:47:20.178426,Activity sing small just network president painting.
750,413,Chat,2022-10-15 11:48:40.081635,Keep police vote treat same voice view rock.
751,780,Email,2023-05-13 03:07:52.746176,Economy store increase team international society agent try Mr radio.
752,699,Phone Call,2020-08-16 08:01:54.673172,Available run which think camera bag defense.
753,32,Meeting,2023-01-28 16:09:03.527388,Fear up price study able only section let television respond.
754,740,Phone Call,2020-09-30 12:08:11.983418,Agency write before center accept best mean.
755,15,Meeting,2022-11-22 08:12:00.999083,Sing industry paper sister exist pay might question talk since.
756,215,Meeting,2022-11-06 11:52:09.624137,Team everyone major high grow Republican.
757,740,Meeting,2024-01-15 22:42:11.449486,Trouble different teacher sometimes set answer everybody customer.
758,384,Phone Call,2023-01-18 12:13:34.514461,Control claim pick group begin step report.
759,35,Meeting,2022-12-08 18:49:13.329872,Later news know nation yard news wife than although owner together on.
760,708,Email,2021-02-17 02:31:27.704042,You ground call election out follow popular surface bed lose actually weight business.
761,187,Chat,2020-11-07 04:42:41.208893,Child important heavy read maintain pretty nice four call.
762,137,Meeting,2023-11-10 22:52:10.402559,Yourself party walk you from trade.
763,167,Chat,2022-02-24 04:35:40.193349,Place grow star middle thank your.
764,153,Meeting,2024-03-12 08:34:39.310136,Kid type along to after book lot song ability record group to.
765,639,Meeting,2022-02-05 15:06:01.200420,Game foreign and itself agree positive including great firm kitchen total piece friend.
766,349,Email,2023-03-08 23:05:01.904008,Look you off boy cover really.
767,672,Chat,2022-05-12 23:37:55.309970,Security affect election someone staff party rather apply level.
768,853,Phone Call,2020-10-25 19:12:40.662699,Wrong nice detail nearly response church deep develop bar blue body.
769,524,Email,2021-12-28 06:14:46.897171,Nothing last within forward purpose north thank yes we reason reason.
770,518,Email,2023-03-23 03:43:49.169034,Him least note member challenge bank page believe recently.
771,103,Meeting,2020-05-08 13:13:13.743496,Later foreign recently vote plan season sometimes right fact lead.
772,695,Chat,2020-03-30 02:40:12.508085,Practice theory less adult follow big investment.
773,388,Phone Call,2020-10-03 17:02:41.885098,Action major article professional condition current general rate my old attention.
774,601,Phone Call,2021-02-07 04:22:00.612249,Though information floor partner prevent quickly.
775,193,Email,2024-03-08 19:39:33.874938,Ten land center country part as parent military born billion fight want.
776,739,Meeting,2021-04-28 22:59:44.565016,Majority itself realize way change story news myself financial team international.
777,243,Email,2023-12-28 09:31:20.227802,Voice television tree far last product wonder all money fish blood.
778,4,Chat,2021-04-21 11:23:22.197931,Training country take stand often present clearly language.
779,216,Meeting,2021-05-01 01:53:10.691766,Peace realize establish as reach summer.
780,396,Chat,2022-12-09 11:59:59.256698,Field say argue forget benefit interest teach development leader speech government.
781,646,Chat,2021-09-12 14:24:22.449747,Change success audience raise on hot force develop current southern.
782,456,Chat,2021-03-03 21:59:53.978344,So school agreement myself chair claim official information forward rich system.
783,194,Email,2020-01-09 22:47:42.388606,Idea conference couple customer half around open source out guy.
784,91,Phone Call,2023-09-02 11:21:46.655270,Notice nearly compare huge from whole record weight yes tough politics.
785,821,Phone Call,2021-05-09 06:55:30.472088,Certainly buy hear idea second line quality respond simple say huge ever.
786,447,Phone Call,2023-03-25 16:43:20.733087,Because past guy anything lawyer stock it others film own purpose.
787,974,Chat,2023-07-23 09:30:21.021899,Theory crime someone thank family entire activity current treat our production would my.
788,722,Email,2023-03-22 10:39:21.972719,Lawyer bar as thank build area like image level policy develop nothing management.
789,74,Meeting,2022-06-26 05:10:35.146976,Agent down three another present yard according kid.
790,127,Chat,2024-04-29 15:17:40.412195,Produce than few ability letter growth design foot mouth member.
791,421,Phone Call,2021-05-04 20:05:23.282974,Firm practice stock street just action protect.
792,737,Chat,2020-02-01 00:50:20.934389,Sign five soldier anyone evidence question political child run act close.
793,485,Email,2023-07-16 19:38:10.940677,Morning sing pick region wish loss.
794,214,Meeting,2022-05-19 22:03:34.849459,Performance every place special half house.
795,550,Phone Call,2023-08-20 00:33:26.245618,Figure interview then beautiful protect note not.
796,5,Meeting,2023-08-24 13:13:05.169704,Gun get why tax beautiful involve want fight.
797,516,Meeting,2024-07-14 12:28:36.106235,Admit look participant program ever some there score explain fish year reduce.
798,123,Phone Call,2024-06-19 08:41:35.930846,Seven none benefit almost red oil itself job.
799,405,Email,2024-02-05 16:30:16.000941,Player discover significant weight sit husband between thing card member pretty.
800,321,Email,2022-11-22 14:57:08.482456,Effect seven western against American its buy window.
801,782,Meeting,2021-07-04 02:03:19.437361,Yeah job prove key Mr get late least matter choose.
802,38,Phone Call,2020-07-03 08:14:11.193212,Try allow left watch table up stand news reality field mean most.
803,900,Meeting,2022-03-20 18:29:55.805459,Smile cost figure necessary statement southern everyone box.
804,817,Phone Call,2023-06-04 06:40:22.808927,House direction company member oil bill executive store stop rock two stop rock.
805,440,Meeting,2022-12-11 11:50:24.753264,Near between minute money gun speech doctor process yard control hundred machine pretty.
806,147,Meeting,2020-11-05 02:47:58.564722,Poor PM anyone close tell population building expert.
807,186,Email,2021-12-23 01:38:43.481964,Let voice short growth certainly list.
808,316,Meeting,2023-12-05 17:35:09.242118,Vote teach require put toward red drug.
809,884,Meeting,2023-11-24 17:35:29.105793,Goal establish with end three prove yeah get single between contain a open.
810,298,Phone Call,2021-07-03 05:33:48.802245,Half environmental while prove right yard husband last magazine fall close sea.
811,783,Chat,2021-06-05 00:20:57.181756,Third tax son let believe cut voice great hear go.
812,552,Meeting,2023-01-09 02:07:10.935582,Official dark right her north difficult name man boy certainly song moment.
813,589,Chat,2022-12-11 14:04:37.905627,Their prove else study local feeling meet speak season.
814,116,Phone Call,2020-10-10 11:39:44.768464,Space quickly effect table voice kid base meet can natural.
815,544,Meeting,2020-02-05 03:52:32.328549,Professor south tend one relationship decide this issue senior person answer.
816,497,Chat,2020-12-18 23:59:49.641612,Audience despite deep wind especially allow anything growth here.
817,129,Email,2024-06-09 13:47:04.289206,Serious receive ability top glass carry himself there three source state.
818,471,Email,2020-06-20 20:27:29.392992,Accept lawyer training continue religious wind option whose school.
819,300,Meeting,2020-05-13 12:56:37.976772,Start walk whom southern well up interest day week free item find.
820,822,Email,2020-04-16 22:28:08.761737,Former drug old really media matter bill capital environmental involve much.
821,46,Phone Call,2021-07-07 08:32:15.099672,Research appear suffer to number year during lot quite night these.
822,880,Email,2020-05-30 21:08:51.321661,Official employee have back law no.
823,199,Email,2020-05-23 16:33:24.706378,Morning common director those station science create glass.
824,198,Email,2021-02-24 00:58:32.925194,Total up success economic goal until alone same.
825,233,Phone Call,2021-05-05 13:29:45.893628,Fine whose current report involve college environment maintain big month.
826,580,Chat,2020-03-24 04:13:30.337730,More opportunity Republican total rather exist pass present.
827,156,Meeting,2023-12-22 01:57:21.258945,Cover agent employee property fill mother upon establish expect.
828,557,Chat,2021-05-26 07:03:04.383651,Sure brother someone institution car perhaps often begin improve appear condition quickly full send.
829,308,Email,2022-06-21 05:47:16.338467,Certain despite source home eat fight according condition today record improve.
830,635,Meeting,2022-04-03 05:16:49.102689,Still street central discuss west example science right fill read source.
831,446,Chat,2023-10-24 11:54:42.712887,Attack these put drive surface tend son as need blue.
832,814,Chat,2020-04-21 00:20:39.046291,Partner you how season bag director positive exist network.
833,50,Email,2023-09-27 20:39:58.733527,Material concern author off every education star teacher result skin bar keep.
834,511,Email,2020-06-08 03:52:29.273897,Human college walk month white production.
835,632,Email,2023-03-12 15:08:34.195681,During measure likely else trade financial.
836,561,Email,2021-11-13 17:14:51.627328,Perhaps war add yet themselves upon friend also.
837,895,Email,2022-10-22 13:04:47.507625,Charge green own particular toward position event.
838,652,Phone Call,2023-04-16 12:01:57.716426,Such serve street often during nearly project hour clearly husband.
839,378,Chat,2021-11-20 12:44:53.766282,Walk relate attorney ability table PM when glass.
840,299,Meeting,2022-04-25 04:31:47.978653,Southern scene health every away under others officer son old good.
841,860,Phone Call,2020-07-18 00:42:31.304630,Care author college you number read support option four.
842,853,Phone Call,2024-06-05 08:42:40.756998,Worker forward current including Mr address beautiful scene marriage.
843,409,Phone Call,2021-06-25 09:18:01.832316,Mean another brother trip religious plan it risk teach church suffer store listen.
844,279,Phone Call,2022-01-31 18:05:45.193573,Rock test environmental money over matter ago story treat return message.
845,35,Phone Call,2024-06-07 06:13:09.898214,Form enough pull teach second beautiful.
846,942,Email,2021-06-20 09:51:07.222561,Report raise sometimes he fast country sign south.
847,161,Meeting,2022-09-02 18:33:37.309526,Executive add debate base thousand available compare.
848,428,Chat,2021-09-22 09:15:45.245736,Half local prepare great must fine side.
849,626,Phone Call,2024-02-28 12:11:56.594058,Wrong real before machine myself cut hour less.
850,616,Chat,2021-10-04 20:21:33.537880,Data wife occur majority month he kid game production animal ahead everything glass.
851,205,Chat,2023-09-24 06:24:23.060584,Mention city friend hundred research college must would along finally daughter.
852,36,Chat,2024-05-17 13:04:32.038096,Car experience spring position store travel actually energy.
853,258,Phone Call,2023-12-18 15:31:29.930896,Simple cut rise than reduce benefit instead sense hot put draw per role.
854,830,Chat,2023-04-06 05:34:30.055007,Manager hand read identify return eight argue region method knowledge.
855,604,Phone Call,2024-06-13 06:25:57.354033,Number radio effort significant film big top where college my.
856,370,Meeting,2021-01-07 10:57:28.203345,Democratic hit personal difference daughter light value financial fall.
857,163,Phone Call,2024-06-27 06:51:55.303063,Kid western store art no happen keep serve significant.
858,487,Meeting,2021-08-18 02:42:20.542398,Color they system skin college win guy.
859,359,Phone Call,2020-10-08 05:52:41.388390,However next situation black yard away best avoid suddenly social during.
860,671,Chat,2022-03-10 14:50:54.839669,Hotel must specific someone scene tree help describe produce career.
861,417,Email,2020-06-12 15:13:31.686954,Subject growth chance source until move.
862,328,Email,2023-03-05 15:13:25.613261,Six sure effect rise PM more range quite same want opportunity strong building.
863,869,Chat,2023-12-16 00:26:39.592681,Learn hotel relate character where near series break believe.
864,575,Email,2024-03-25 13:17:17.170678,Cup argue imagine even fast season foot color couple visit cut seek.
865,877,Phone Call,2024-02-13 19:34:25.868676,Medical travel wife environment east road pull anything remember eye.
866,278,Chat,2021-12-18 08:59:41.453603,Today soldier kind grow surface figure table action head just already.
867,264,Phone Call,2024-04-22 19:16:02.883654,Shoulder analysis heavy yard stuff third finally.
868,720,Meeting,2023-08-26 00:22:18.735247,Mouth size finally lay reduce place clear force audience move.
869,729,Phone Call,2022-02-27 02:33:25.830986,Mrs worry real series consider floor community officer.
870,749,Meeting,2022-10-11 15:04:34.438274,Budget actually government mean pay beautiful consider sure case actually most.
871,849,Meeting,2021-02-17 21:09:29.912005,International listen fish ten simply behind as try personal sure word bar prevent.
872,716,Email,2020-07-21 20:33:21.691168,Safe debate return summer much spring outside common.
873,576,Meeting,2020-02-20 15:07:16.888813,Trouble raise factor suddenly way nothing such young both along could manage.
874,135,Email,2021-12-12 22:14:56.687082,Sister office letter too central which record job.
875,534,Phone Call,2020-01-02 21:39:05.122291,Happen on national look research animal.
876,21,Meeting,2024-04-06 14:32:32.546859,Goal responsibility sure fact believe trip than street toward call since position.
877,34,Email,2023-02-22 17:41:28.921038,Congress fight close mouth sound expect.
878,795,Phone Call,2021-05-28 03:26:03.555993,Box form walk win approach health foreign.
879,681,Phone Call,2023-10-16 03:51:42.062204,Pick campaign with similar to quite data remain court.
880,792,Phone Call,2020-06-19 16:24:44.104243,Lead worker you institution their participant during center learn someone couple.
881,508,Phone Call,2020-11-04 20:54:41.002781,Music there dark feeling at accept.
882,540,Email,2022-09-18 05:02:21.187575,Evidence chance interesting class resource tree because government key.
883,763,Chat,2020-08-08 21:02:37.036444,Staff and carry ability wrong participant eye.
884,266,Phone Call,2022-02-25 02:49:11.818260,Analysis season deep industry arrive skill so green support far end.
885,845,Chat,2020-01-04 00:16:53.827775,Admit society market huge I democratic benefit in make.
886,519,Email,2022-09-21 02:30:32.490693,Spring service minute store author lose hit.
887,27,Chat,2020-05-09 01:57:11.425123,Fight sense them bad where visit media decade adult tend behavior beautiful around.
888,123,Email,2020-01-03 09:29:02.613503,Above buy day job behind discuss into quickly west voice ever buy often.
889,742,Email,2022-09-22 07:13:25.027230,On free enough want expert conference coach hit room stage.
890,202,Meeting,2020-11-07 02:02:12.822827,Several land dog itself him tough.
891,44,Chat,2023-06-13 16:49:40.795610,West example buy church us might become expert.
892,915,Phone Call,2022-12-21 03:38:50.358868,For suddenly international itself couple clear event concern development we final good.
893,688,Email,2023-01-07 03:32:06.283664,Range who official home ask evidence.
894,414,Meeting,2022-10-01 08:35:58.114778,Interesting remain themselves alone apply media.
895,951,Chat,2021-11-15 00:18:29.893445,These he room air result second however.
896,80,Meeting,2023-10-25 21:28:36.183379,Administration majority difficult second exactly radio red wide hard control within street professional.
897,372,Phone Call,2024-06-19 16:19:37.791157,Pattern memory goal down drop international test that likely your only detail job.
898,352,Email,2020-05-12 13:08:05.694594,Speak training throughout mean kid particularly.
899,860,Phone Call,2021-10-21 03:01:14.236016,Drive assume similar effort director media above describe yes trade speech.
900,60,Chat,2021-09-25 11:05:52.952463,Enjoy anything billion various hour up whom fall happy idea.
901,428,Phone Call,2021-01-17 17:33:04.415830,Investment care simply writer foreign movement respond.
902,372,Phone Call,2020-07-06 01:38:12.776860,Gas prove including range top want letter.
903,358,Chat,2022-04-23 03:38:49.733406,Happen gas station treatment spend apply operation perform.
904,634,Email,2022-06-09 19:47:40.540619,Until may away health team task suddenly summer soldier produce attorney five.
905,17,Email,2021-07-18 05:46:13.138232,Shake deal likely owner woman wonder begin herself remain.
906,499,Email,2023-05-12 12:01:17.659088,Well particular even TV begin wish or how three three daughter surface.
907,919,Chat,2021-02-25 22:30:44.806908,Quickly base middle car stage enter television talk term within might fine lawyer.
908,452,Email,2023-12-12 16:04:28.957932,Scene reality view analysis listen religious beat author.
909,397,Chat,2021-04-04 00:07:56.777821,Somebody spring build mention available risk commercial young relate art quickly image.
910,991,Email,2021-07-08 07:56:17.203245,Development particularly month piece say history development wear employee glass six strong your.
911,198,Phone Call,2021-02-23 17:51:06.331179,Suddenly place everybody training manage case pick music lose stand.
912,56,Phone Call,2022-01-01 03:19:35.413106,Concern heavy attorney very thousand everyone anything rest.
913,792,Meeting,2023-08-30 04:15:26.811822,Develop this firm surface among down consider affect.
914,669,Chat,2023-06-09 21:17:46.727676,Letter change dark economic sign know loss.
915,209,Meeting,2022-07-21 02:13:48.549518,Practice line test system all money today other ball level responsibility task.
916,590,Chat,2020-08-28 14:34:24.114989,West garden nor it discuss treat.
917,401,Email,2021-02-23 16:44:08.382215,Two company measure exactly education physical Democrat others.
918,606,Email,2022-06-22 14:18:17.432084,Score child thus now feel institution form throw choice possible.
919,254,Phone Call,2023-11-18 20:00:34.820814,Less within view who figure laugh yourself they someone friend yeah.
920,300,Email,2020-04-10 07:47:30.303373,Tree hour town board field key her card force shoulder expert wish.
921,212,Chat,2021-04-10 17:21:06.402244,Of require whatever network radio board beat tough.
922,110,Chat,2023-04-25 22:01:07.595477,Indicate movie analysis from TV water important movie cost you religious table term.
923,520,Email,2020-08-16 01:03:02.571411,Vote well figure issue outside radio take case.
924,854,Email,2021-05-27 20:28:47.383554,Detail building concern purpose usually knowledge small prevent.
925,2,Email,2023-07-12 04:34:55.220748,Smile institution woman pattern popular culture only help employee.
926,398,Phone Call,2020-09-15 03:33:36.118114,Explain box middle treatment resource doctor stock chair law TV.
927,306,Chat,2023-11-21 15:12:30.554050,Kitchen teacher magazine compare none themselves military trouble.
928,877,Chat,2020-12-26 21:14:17.202875,Throw foot spring fear manager Republican radio admit now amount language.
929,343,Email,2024-03-08 19:53:17.151047,Popular discussion race as deep really line really behavior after.
930,224,Phone Call,2022-12-21 09:25:32.565095,Machine could shoulder may situation fall provide.
931,67,Email,2024-01-23 02:39:58.212385,Subject little answer adult common light eight way.
932,873,Meeting,2020-12-05 23:17:11.253461,Sea such western style name shoulder five huge.
933,60,Email,2023-12-15 12:49:15.577751,Model since risk century spend conference ten.
934,201,Phone Call,2023-10-01 02:35:13.778819,Development forward life card rest mouth.
935,513,Meeting,2020-03-02 19:15:59.373307,Skin beyond make dark wish scene safe anything spend think system.
936,453,Chat,2021-07-21 14:39:59.440102,Physical hospital education face high talk factor peace.
937,954,Email,2023-08-25 20:23:43.233308,Outside day make last quite risk music marriage risk Mrs.
938,531,Chat,2020-03-18 04:34:20.544158,Decision hard talk marriage national along.
939,873,Phone Call,2023-10-21 00:19:12.113528,Coach score individual why arm child action plan step.
940,36,Chat,2024-06-11 18:12:21.476419,Card west throw court participant middle various car.
941,922,Meeting,2023-03-31 23:54:28.792946,Network art look far join radio various teacher base north country.
942,388,Phone Call,2021-01-18 23:48:11.543750,Floor seven professional increase tree their even many.
943,703,Phone Call,2022-03-24 00:34:50.609834,Firm child require candidate movement however policy skill seat.
944,415,Meeting,2021-04-23 23:15:03.117025,Question throw process floor course show.
945,474,Phone Call,2022-03-10 12:28:34.058541,Method medical scientist remain federal only top her without realize.
946,57,Email,2020-08-30 11:00:26.338000,Today serious development animal job population.
947,951,Phone Call,2021-11-11 19:17:06.855361,Effort event opportunity instead staff agent red pass water rich finally herself.
948,660,Email,2021-04-09 10:06:12.627565,Enough tend we allow let miss real present rate.
949,309,Meeting,2023-09-17 16:47:46.655761,Son whose inside oil report management.
950,471,Phone Call,2022-03-08 04:40:28.591831,Send law blood decision others camera a ever third family policy but across.
951,493,Email,2022-06-25 00:01:46.149316,Big present our I peace report by figure range respond travel whose raise.
952,894,Meeting,2021-04-04 17:34:02.700006,Network not live number class beyond.
953,425,Phone Call,2022-07-18 05:57:07.354535,Play move president arm attack same ever fill operation.
954,423,Email,2021-10-13 03:20:30.526629,Human fact heavy official weight weight win between into of.
955,698,Meeting,2024-03-25 05:42:27.065860,And technology price begin customer live plant conference themselves her sometimes material night.
956,574,Phone Call,2020-10-06 03:14:56.957877,Customer science soldier themselves reduce suffer color apply.
957,712,Email,2023-01-23 08:01:44.678904,Base stay near role health test for such how.
958,449,Email,2022-08-06 09:28:26.361530,Cause bag remember other improve have while condition follow.
959,604,Email,2023-02-07 09:29:05.267651,Mouth stock bit take contain activity beat develop together thousand not from.
960,709,Chat,2021-08-23 03:28:42.347818,Across imagine cause assume military boy recently risk responsibility natural back system last.
961,231,Phone Call,2024-03-12 21:04:04.117615,Space present operation in purpose produce hand.
962,315,Chat,2024-03-02 16:17:16.472718,Tough should a follow place respond ago brother conference really human.
963,936,Email,2023-12-10 17:36:21.277557,Professor item join big floor bill may civil.
964,500,Email,2020-11-11 20:58:42.803478,Number instead level recently challenge garden price so.
965,443,Phone Call,2022-03-12 07:35:28.179940,Style shoulder difference pressure say weight business dream likely discussion affect.
966,389,Email,2021-02-16 08:50:47.177914,Partner little general stop space store.
967,216,Email,2021-07-08 10:48:58.129377,Need democratic statement increase any answer look look democratic.
968,488,Phone Call,2020-07-08 08:20:25.424988,Write machine environment want cover fall.
969,909,Email,2021-01-19 00:23:42.669341,Serious main approach maintain wear national lose talk production action forget.
