interaction_id,customer_id,interaction_type,interaction_date,notes
240,41,Email,2022-07-21 22:19:46.023831,Wrong investment discover baby measure carry president.
241,499,Phone Call,2022-10-23 09:20:28.019738,Back staff hard memory worker anyone.
242,717,Meeting,2023-07-09 00:26:58.447806,Painting race even near cell difference reality piece face.
243,975,Chat,2021-08-09 23:47:25.081581,Response teach arm short certainly theory.
244,853,Phone Call,2020-02-18 11:18:10.996313,Model act expert pay can week order.
245,728,Chat,2023-05-17 00:58:25.610119,Result bag star space like age senior leader side nature law live cover.
246,216,Meeting,2022-11-12 00:18:48.792354,Few letter family girl popular Mr out computer herself.
247,703,Phone Call,2022-10-20 15:37:38.899427,Type good book beautiful begin know writer billion eye affect really rather especially.
248,555,Meeting,2021-04-16 15:30:15.431242,Phone car forward money employee enough bit amount detail player more.
249,696,Meeting,2022-06-19 16:34:26.729159,Which field face quite school mean next respond idea wrong call identify worker.
250,101,Chat,2021-08-11 19:12:26.833786,Glass within watch sea situation force bag not campaign fine possible activity.
251,310,Chat,2022-02-28 17:43:39.276051,Culture stop democratic too thank level process body seven.
252,290,Meeting,2024-05-26 12:45:31.077778,Effort use around whom although week assume benefit someone much sort guy.
253,980,Email,2023-07-14 01:26:56.887349,Artist hard hot activity any huge company.
254,419,Meeting,2021-10-26 01:19:22.239750,Treatment early sister interesting girl through reveal full.
255,273,Meeting,2022-07-17 12:32:32.642097,Board wrong kid question court quality player talk base follow serve fine man.
256,367,Phone Call,2021-10-16 05:09:44.357626,Any voice while sell another occur it allow.
257,461,Email,2020-06-24 03:51:08.557083,Behavior water full forget system glass wrong because way between relate indeed.
258,225,Chat,2021-07-29 06:24:35.745041,Lot require standard final according doctor.
259,857,Chat,2023-06-20 15:38:42.223248,Natural ready return team day produce.
260,149,Chat,2021-06-26 00:43:00.716521,Effect without even item large above against happy community TV.
261,17,Meeting,2022-12-22 12:17:09.821456,Former what alone rock cell others wear.
262,876,Phone Call,2023-07-04 03:43:42.449411,Fall too need staff minute learn service per.
263,380,Email,2022-09-23 04:07:17.847472,Outside quality hot since boy likely mouth fine.
264,832,Phone Call,2020-03-17 11:31:34.506460,Her consider involve impact trial really bag including there no stuff.
265,942,Email,2024-01-19 01:30:21.944480,Dog very official assume include again seek apply top.
266,606,Meeting,2020-05-24 03:12:14.440598,Let turn thousand executive ever democratic over notice budget main fine.
267,623,Chat,2022-12-13 23:14:08.967212,Role establish should investment me generation anything low late arrive forward president medical.
268,382,Email,2021-03-16 23:32:01.157703,Month watch within other could use.
269,554,Email,2021-03-07 22:35:43.094346,Face something important lead knowledge at official pattern mother.
270,706,Chat,2024-04-17 10:00:13.343168,Relate argue class final notice nothing.
271,816,Email,2021-10-11 21:33:34.586579,Your option test appear assume mind.
272,592,Chat,2022-05-04 14:34:02.428401,Course product board remain however experience stuff full study spring go give.
273,356,Meeting,2024-03-02 02:02:11.208960,None another product long rich ball smile television mouth right talk control there.
274,261,Chat,2021-01-13 00:48:24.916100,Congress force quite grow true blood cell along low.
275,271,Phone Call,2024-01-29 09:17:31.585852,Accept and computer himself very response word sister old senior more.
276,625,Chat,2022-01-10 15:27:33.553989,Reduce guy few happen join easy training catch media.
277,47,Phone Call,2020-12-27 02:58:55.555581,Around reduce recent woman subject data sister investment station face structure environment.
278,476,Chat,2023-05-25 15:10:44.907178,Write suffer born represent him training still make everything then book be process make.
279,373,Chat,2022-09-25 15:17:41.516024,Involve set week want realize too attorney woman agree adult face.
280,18,Chat,2023-12-21 10:37:48.343906,Themselves while impact near several year month source where step.
281,325,Meeting,2020-03-22 16:04:38.441139,Provide everybody sport daughter argue coach either offer where.
282,590,Meeting,2020-04-06 02:23:07.104302,Should concern recently nearly week concern.
283,160,Meeting,2022-03-09 00:24:48.418704,Woman hope away top recent six west against across.
284,946,Email,2024-01-23 14:46:59.842288,Fight agent six degree idea include middle concern to front.
285,816,Chat,2024-06-01 09:00:08.810049,Friend light clear cultural remember however job.
286,147,Phone Call,2023-10-29 05:15:03.683784,Name reflect property strategy surface apply.
287,700,Phone Call,2023-05-29 19:11:32.130877,West remember too TV size fact room.
288,190,Email,2020-11-14 00:28:51.705499,Serve even far under than power beat single.
289,480,Meeting,2020-08-28 02:46:09.303260,Whose oil once question summer thank choose indeed.
290,803,Meeting,2020-11-29 22:07:32.647730,Good most fear suffer information artist attack lead town next evidence want among.
291,443,Phone Call,2022-06-10 15:09:40.568102,Husband student game executive prepare take administration commercial positive answer executive draw wife.
292,80,Phone Call,2021-09-16 17:41:01.480699,Minute forget become machine perhaps situation wrong dinner return standard daughter soon receive.
293,257,Chat,2021-10-08 07:12:17.401865,Good social eat such determine sell personal between ten Republican executive Mr my.
294,81,Email,2021-12-08 03:51:28.316030,Collection ability player single best east mouth dinner couple each prepare friend.
295,100,Chat,2022-04-15 08:02:59.722572,Shake trade election mother explain ask whether spend although require common.
296,829,Meeting,2022-10-10 15:42:32.508492,Cultural enough drug apply lay challenge west wonder prove perform.
297,75,Meeting,2023-06-19 02:30:26.579302,Try production very impact stage wind.
298,750,Chat,2020-05-19 16:09:49.973884,Address down Mrs consider score group into.
299,766,Meeting,2023-07-12 06:23:23.421417,Close north term dinner us still any suddenly meet.
300,664,Meeting,2023-02-28 15:12:38.318561,Sure though compare subject those pattern other administration someone yard.
301,874,Chat,2024-02-02 15:01:08.852385,National green tough can certain morning identify partner city expert dog too.
302,905,Email,2022-01-29 04:55:39.867026,Single organization cut yard of second realize expect necessary early.
303,239,Chat,2022-03-29 11:02:02.444599,Put measure by check center field smile hotel body human.
304,165,Chat,2023-05-13 21:44:03.475545,Six team measure in shoulder discussion by two since.
305,877,Phone Call,2020-10-31 05:08:16.527291,Month matter stop recent likely Republican social plan call.
306,578,Meeting,2023-02-02 16:00:31.700555,White window coach short challenge study.
307,112,Meeting,2021-01-07 11:37:55.527941,None how trade character garden understand have reason.
308,395,Meeting,2021-06-04 08:42:09.832731,Less control real stuff free fly son data.
309,533,Meeting,2024-01-11 22:01:56.216277,Certain card service dog down head television tell east.
310,275,Phone Call,2020-07-16 14:25:46.633704,Summer remember leg become possible nature reason decide later happen before.
311,867,Email,2020-08-26 21:54:59.339040,Science value whom prevent actually scene bed especially.
312,351,Chat,2023-05-23 15:33:36.122592,Strong produce hard green question those media third.
313,951,Meeting,2022-01-21 12:40:23.769813,Serve address light again everything street system ability figure level price.
314,208,Email,2021-07-06 21:03:01.122421,On teach son data protect entire in fight recognize born anything agree plan.
315,431,Email,2020-06-25 16:42:06.216609,Down time population myself tax mother gas.
316,659,Email,2023-08-31 10:50:13.438931,Republican forward level seek now century employee send.
317,904,Phone Call,2023-04-14 22:19:27.333596,Care stand three agreement class coach.
318,838,Email,2024-05-25 19:54:05.263416,Option include low sign issue skill attack choose government history.
319,331,Email,2024-04-16 05:46:03.767543,Three treat plan week able reflect daughter sure.
320,450,Meeting,2023-05-30 11:34:28.907522,Give lay option thus bed positive suddenly something instead.
321,276,Chat,2021-10-09 04:19:43.244645,Mother impact fine family buy include budget.
322,605,Email,2020-03-16 06:28:13.666538,Sport business make concern Congress always far few night go relationship.
323,106,Meeting,2022-09-05 02:46:44.289818,Effect answer someone conference dream plan weight reality career state assume hospital.
324,482,Email,2020-01-22 19:59:28.308928,Wear need money best performance stage woman other anyone of.
325,821,Meeting,2021-10-07 01:58:36.695229,Community view reduce rich image source beat play civil culture to near material.
326,441,Email,2020-01-20 06:38:28.523110,Training lose show rock most hand.
327,125,Email,2020-12-17 06:27:28.007490,Without create treatment continue return yourself.
328,276,Chat,2020-05-10 09:09:09.509975,When include free try government many course.
329,17,Phone Call,2024-02-24 21:47:51.342040,Stand buy across compare dog article modern deal.
330,705,Chat,2024-06-25 03:50:54.990114,Bit by idea report hear parent item must improve consider cut career thousand.
331,260,Email,2022-08-31 19:52:40.807361,My executive blood smile already almost example white should fill.
332,520,Phone Call,2021-11-20 19:26:01.573188,Study perform behind condition second ready energy just eye research.
333,445,Phone Call,2020-06-06 05:13:20.291076,Large partner nearly value measure early phone.
334,632,Email,2022-07-14 13:19:47.569643,Father sit theory run official attention according.
335,122,Email,2023-05-21 17:07:45.571357,Kind from item until add suddenly suffer.
336,947,Email,2020-04-04 11:05:23.001364,Present seat health bed treatment wish action energy because center same job.
337,594,Meeting,2023-04-18 01:12:01.700503,News quality hope sense strategy tax stock hold last worker indicate.
338,688,Chat,2023-02-20 09:11:14.892594,Wind available moment represent world say security power reach.
339,670,Email,2021-03-12 20:32:37.435685,Listen according chance similar country people course drive box wear score.
340,683,Chat,2023-05-18 20:05:33.684624,Style key bring buy else against.
341,84,Chat,2020-06-26 02:18:25.801536,Method travel role company leave full rather manage.
342,288,Phone Call,2024-05-14 00:38:22.350130,Wife hard fast hope hair government need smile care market.
343,551,Phone Call,2023-12-22 01:37:01.933957,Son day include money ask protect early back event some step from local.
344,76,Phone Call,2022-12-18 14:47:21.047341,Record forward yeah budget environment local somebody style.
345,206,Email,2020-01-26 08:42:39.412376,Get worry reveal gun improve source American learn.
346,606,Meeting,2024-04-17 05:40:00.691849,Area win especially likely around cold probably allow nothing project sound water.
347,134,Meeting,2020-03-06 09:41:07.720303,Country sound anything lay bit compare.
348,303,Email,2020-02-15 11:12:46.807520,Why eat be beyond main project threat report media check task.
349,136,Email,2023-11-08 17:48:15.668431,Book response right before season thought election station child.
350,370,Email,2024-06-10 14:00:26.947782,Better land learn put well large staff.
351,664,Chat,2022-12-25 15:36:24.912513,Season field sing strong series usually help garden structure themselves how.
352,419,Phone Call,2022-07-25 17:26:35.480401,Care health out admit agree ahead everyone western call Mrs.
353,121,Chat,2022-06-30 10:40:17.193004,Woman course sense other act team interview.
354,164,Chat,2020-08-17 09:34:03.877666,Third indicate collection action hand individual.
355,818,Email,2024-04-21 15:27:03.452452,Them model me pick share rock pattern discussion pull development home.
356,125,Phone Call,2023-09-24 14:34:56.753884,Child bit who wish actually all easy sing experience.
357,788,Email,2022-10-25 11:01:27.969689,Past minute energy top remember any responsibility across data.
358,763,Phone Call,2020-03-22 03:41:36.290294,Specific spend daughter must traditional them.
359,339,Meeting,2023-11-30 16:03:24.551612,Which easy surface bed respond ever sell today represent huge production table system share.
360,444,Email,2021-12-11 07:54:20.474106,War environmental discuss story major large already strong recognize hot moment field activity.
361,388,Phone Call,2022-11-02 22:30:42.749666,Small arm attorney lose enough use feeling southern truth follow because few.
362,496,Phone Call,2023-12-26 17:17:24.006363,Newspaper we finally woman few office investment through include draw stuff know natural.
363,404,Email,2024-06-12 03:18:18.343215,Surface side vote manager project challenge argue rich responsibility land forget.
364,690,Phone Call,2021-12-24 15:02:56.782489,Fly the great sign end important resource.
365,256,Chat,2023-03-16 21:57:37.634925,Yourself air scientist free than large.
366,262,Email,2020-02-26 16:59:48.187215,Daughter risk behind near soon less side current pressure production.
367,445,Chat,2020-09-07 11:42:04.776608,Across result mouth summer child third during remember get memory push spring.
368,524,Phone Call,2020-08-23 06:41:49.901719,Effect play kind bad voice body event thought include.
369,690,Meeting,2022-05-19 18:53:59.881202,Benefit age remain attorney modern pick state baby pick cover.
370,909,Chat,2024-06-02 17:10:36.700683,Teacher to system simply maybe year.
371,502,Chat,2020-01-09 12:42:48.047445,Bill movement important would receive west themselves air upon for.
372,406,Meeting,2024-06-21 22:28:25.644283,Fear source who need father less meeting sister consumer memory.
373,693,Chat,2023-03-11 03:04:27.312274,Medical you PM avoid energy card contain clear various city.
374,401,Email,2022-04-15 09:00:24.970218,Pretty difference woman old approach establish deal perform leave.
375,1,Phone Call,2020-06-27 20:30:40.751499,See yeah office professor I special lead cultural example report.
376,365,Phone Call,2020-06-20 12:14:12.635975,Cut statement sure yourself base situation while young others.
377,290,Phone Call,2021-09-30 12:40:49.481369,Hope put especially name bit anything hospital party.
378,328,Meeting,2022-01-29 16:14:55.056393,Must with difficult yourself mission necessary.
379,699,Meeting,2020-12-25 00:25:09.886256,Financial seem either bit painting hope gas down.
380,87,Email,2024-04-23 02:55:09.443374,Cut spring may head approach leader particularly again boy sort behind other.
381,145,Phone Call,2023-02-26 06:56:37.265920,Service represent the generation catch hit research student administration myself.
382,910,Chat,2022-11-25 13:28:23.579665,Watch course note live economy fly.
383,942,Phone Call,2023-01-10 10:23:56.940535,Some we himself animal play director interest while usually friend produce.
384,537,Meeting,2021-04-14 20:24:32.028932,All myself region maybe beyond common culture table country like full sing.
385,195,Email,2024-04-20 12:53:06.414560,Them consumer six social area direction audience ask attack wear rather risk write.
386,86,Meeting,2021-05-07 04:35:35.455500,Smile party evidence have something although no middle race.
387,602,Meeting,2021-03-19 01:05:47.427271,Need pressure discussion official determine history force right include.
388,416,Chat,2020-10-01 03:49:13.805640,Health officer her someone pay next option page herself maintain.
389,807,Meeting,2023-08-31 15:40:54.933842,Reach place move party so main night child still cell.
390,484,Phone Call,2020-10-03 04:42:17.338215,Message indeed pressure money everyone contain few guy network year here many.
391,769,Meeting,2024-05-25 21:17:59.874103,Job computer particular ago open behind money bill perform.
392,109,Chat,2020-12-01 11:53:47.173088,Nice reason enough follow find alone nothing skin.
393,244,Email,2022-09-02 06:10:20.753610,Board shake ask beyond there action seek report bar he drop.
394,493,Email,2023-12-18 18:05:39.519104,Animal too myself nearly win wife.
395,493,Meeting,2024-04-07 13:42:09.198107,Member reflect place long perhaps relationship.
396,55,Chat,2024-04-27 14:37:23.581897,Clear guy low lot campaign pressure now game describe measure drive toward history.
397,757,Phone Call,2021-09-16 11:07:30.680784,Job second more various population talk no race.
398,54,Meeting,2023-12-27 09:14:42.362808,Follow a let service avoid into.
399,508,Email,2021-07-04 11:47:35.334621,Line third identify sometimes direction clearly per popular so foreign mission sound.
400,947,Meeting,2021-05-14 08:35:27.488253,Part mother benefit Mrs sport southern remember pattern north food.
401,534,Meeting,2020-02-09 23:25:51.570038,Common morning mention military past result thus skin key since per.
402,581,Meeting,2024-02-17 13:25:12.069717,National like red wait old small.
403,872,Phone Call,2023-08-27 22:21:55.648757,Condition when occur agency agency maintain that TV against particularly be somebody each listen.
404,415,Email,2020-04-15 15:39:27.016075,This reach church every toward ever yet step soon former baby wife.
405,946,Email,2022-11-07 08:46:36.131155,Kind statement help teacher enjoy scene story.
406,597,Phone Call,2021-12-19 07:58:18.776614,In mention management seem look method ask total year rise necessary without.
407,69,Meeting,2020-11-30 23:17:20.966424,Candidate note court culture standard environment fire hand our senior anyone your.
408,736,Chat,2021-07-31 10:39:30.112723,Hundred weight list ok road view low.
409,388,Phone Call,2020-03-30 04:58:55.337928,Hand kind leave popular leg feeling there campaign sign late analysis business seem.
410,816,Meeting,2020-10-05 14:48:55.151588,Yet guy quickly herself medical prevent movie.
411,85,Phone Call,2022-11-16 10:29:59.057979,Important draw according learn star order career audience material change language election.
412,438,Meeting,2021-07-22 14:27:27.312741,Action yeah fly difficult box interview mean evening improve avoid.
413,429,Meeting,2023-11-13 06:20:04.963854,Method middle those different doctor lawyer during task water last.
414,75,Phone Call,2021-03-27 04:16:11.919253,Series structure contain thank before couple.
415,847,Email,2023-01-05 12:20:10.804282,Somebody tough wish public bar community painting everybody animal young recent light especially.
416,277,Meeting,2021-06-22 22:02:07.240178,Surface leg world magazine plan moment rate computer star board.
417,970,Meeting,2021-09-04 00:13:00.440233,Consider fire billion rule institution though able amount tax second future.
418,306,Chat,2024-07-21 13:00:20.940950,Benefit all although often level line finally concern husband phone rise impact country.
419,475,Chat,2023-09-26 23:39:14.652101,Offer simply performance few actually recently green call rock go husband foreign.
420,314,Phone Call,2020-01-10 00:22:12.577235,Democrat million even card common together hear cup.
421,138,Phone Call,2021-04-03 20:57:56.729370,Radio police crime smile half already perform for level sea under.
422,435,Chat,2021-08-24 03:18:14.386035,Rich world girl wrong focus himself message second memory.
423,60,Email,2022-06-10 04:16:50.215282,Project ask house we yes even late.
424,58,Email,2022-03-16 17:11:30.429579,Project animal gun own sing sit forget magazine walk realize dream from these.
425,9,Email,2023-06-24 06:52:23.056216,Interview toward just know daughter camera point public throughout executive but pattern commercial.
426,642,Phone Call,2023-10-06 02:42:55.954378,Walk choice practice house itself must mission mind.
427,502,Meeting,2024-04-28 10:10:58.578412,Arrive budget again main small name general approach.
428,600,Chat,2023-05-18 23:37:58.745613,Agency whatever different check main fall some finish part personal since.
429,41,Chat,2020-01-30 08:05:53.970665,Wear someone why population sure TV affect future money spend total represent write.
430,927,Meeting,2021-06-12 04:01:58.873444,Factor special model appear huge each three follow enter.
431,295,Phone Call,2020-01-19 20:26:36.315361,Plan probably Congress charge officer here hand seat.
432,313,Phone Call,2023-07-03 13:37:16.433749,It trouble management father kitchen anyone light full word two civil.
433,734,Phone Call,2020-06-03 16:06:29.639874,Lose key really pull seek long treat myself hard only interesting.
434,587,Phone Call,2020-08-17 22:09:03.455366,Young partner notice I whose former bad story everything wait first shake reveal.
435,776,Phone Call,2020-05-04 17:25:50.131278,Understand tell man life always beyond seven happy marriage commercial mean.
436,916,Email,2020-01-25 11:53:55.706216,Seek thousand participant detail population great.
437,513,Meeting,2020-02-25 21:53:34.942866,Relate season three Republican choice student reality personal player rule consumer sea.
438,924,Meeting,2023-09-19 10:52:51.092872,Language kitchen behavior than project official.
439,345,Chat,2023-04-04 17:09:29.858754,Service drug land where rather them little simply.
440,63,Meeting,2021-06-16 01:09:39.172632,Politics hand support education hold seem purpose else society kid.
441,84,Phone Call,2024-03-27 18:33:32.973910,Yet I remain ball pull cover decision watch as air resource usually.
442,257,Chat,2021-01-18 23:14:14.746814,Old follow strategy newspaper difficult throw.
443,649,Phone Call,2020-08-05 08:36:46.924847,Customer around among throw develop card may.
444,925,Meeting,2020-01-21 01:38:27.222017,Seek bad discover never spring away material unit.
445,9,Email,2020-04-07 16:11:31.502912,Produce nothing sport remember war stage school our trial question.
446,760,Phone Call,2024-05-22 14:24:09.617413,So especially hit east million able avoid crime physical.
447,533,Meeting,2022-05-03 10:14:24.481678,Yet western can happen certain financial participant.
448,552,Phone Call,2021-09-20 05:37:47.672673,Discover model travel expert more become company.
449,730,Meeting,2023-06-14 20:03:26.405208,Meeting sell police outside make now statement sit east control.
450,158,Phone Call,2022-09-04 10:59:22.400553,Mrs child man account explain against service building court.
451,288,Email,2022-07-05 07:47:54.660228,Fall property benefit audience growth contain read social outside reveal population draw option.
452,873,Email,2022-11-09 16:39:53.475086,Suggest require must ask culture rich student ten upon pick author land.
453,916,Meeting,2023-09-22 21:43:47.370492,Lay wear light capital floor already film practice fear.
454,850,Chat,2023-03-15 19:25:57.542052,Line candidate per from person partner computer manage environmental accept along.
455,381,Phone Call,2023-08-19 15:02:51.353159,Her free bar hit office often member course parent speak my group.
456,140,Chat,2020-12-02 19:25:24.802970,Decide entire night area especially growth stay ability treatment product.
457,24,Chat,2021-08-01 01:58:13.561694,Exactly make agency safe yes like government magazine hundred.
458,529,Phone Call,2020-06-24 23:49:17.925151,Soon run face then seek his impact there.
459,216,Chat,2021-11-26 03:46:50.171583,Fine condition pressure interesting form reason measure population green study tend nearly.
460,765,Phone Call,2021-04-22 10:31:21.824985,Respond defense other along return car.
461,208,Meeting,2021-10-09 14:08:30.390666,Hope soldier authority experience lawyer campaign far.
462,927,Email,2021-08-20 08:39:28.322651,Nice home energy former special trial six difference understand sense.
463,532,Phone Call,2023-12-10 16:02:00.607187,Red who thousand air according contain interest couple story together institution room.
464,463,Chat,2022-09-29 22:50:08.686641,Land source speak yeah popular church interview condition today body.
465,234,Email,2022-11-12 20:46:15.148238,Structure leave school say bag send particularly thank.
466,907,Email,2021-11-01 00:18:38.339778,Live four almost lawyer watch college live far onto.
467,595,Meeting,2022-05-02 11:45:46.968200,Performance camera range rate management report.
468,124,Phone Call,2024-03-11 04:05:17.501080,Ask network film own anything sort strong they notice put fight hit.
469,972,Phone Call,2023-07-08 22:12:18.039487,Almost go baby wife blue language central method phone adult present speech.
470,360,Email,2023-05-01 05:06:31.681259,Point operation face agent mouth administration war generation throughout.
471,517,Chat,2020-12-19 05:44:57.369366,Easy occur lot certainly open sing force already not.
472,806,Email,2023-10-01 20:58:02.604391,Approach rock town energy economic ten same.
473,697,Chat,2024-03-29 10:45:36.270320,Car if a reality general lose talk north up economy serve case sure.
474,19,Meeting,2021-11-26 11:25:34.105032,Important goal turn dog successful raise I option listen kid.
475,121,Meeting,2024-02-29 02:39:23.372761,Yourself read leave relationship discuss toward enter central plant spring room.
476,77,Phone Call,2020-09-18 11:22:03.847623,Civil citizen yet allow key hair share realize same official professional animal move.
477,982,Chat,2024-04-11 04:40:08.429515,Without yeah growth protect toward interview weight check stuff without whatever.
478,895,Chat,2024-06-03 17:16:26.941504,Quickly less president military north civil four whole PM according although experience dark.
479,258,Phone Call,2021-06-17 18:08:07.650356,Improve face start measure budget leg tonight those about amount rule less.
480,656,Meeting,2024-01-10 23:44:45.150102,Subject wonder realize few pass impact high.
481,379,Email,2020-07-26 16:46:36.864305,Magazine top difficult success over station national.
