interaction_id,customer_id,interaction_type,interaction_date,notes
482,685,Chat,2024-01-12 19:48:23.701457,Cover grow across run model certainly exactly perform discuss.
483,862,Chat,2020-02-04 20:05:47.823788,Report ten may traditional pick sister eye me.
484,202,Phone Call,2021-09-30 00:05:28.174982,Concern computer moment authority most hot.
485,919,Chat,2023-04-16 09:41:48.390613,Town I voice next manage know nice black.
486,29,Phone Call,2020-07-07 03:18:08.202467,Tree bit purpose crime administration just.
487,632,Chat,2021-12-30 19:05:20.765762,Soon recent guess west voice plan music measure describe.
488,863,Meeting,2024-04-20 00:38:50.550756,Perhaps direction capital fall apply product take region front.
489,51,Meeting,2023-02-18 08:23:49.036382,Unit cover whatever stock hot fly miss attack when off.
490,803,Meeting,2023-06-19 18:15:00.620949,Quite share democratic trial help usually mean yes just move.
491,588,Meeting,2022-04-09 18:08:26.057631,Exist after argue onto set tonight possible skin court reflect increase.
492,698,Email,2022-05-24 19:00:42.109807,Blood huge movie discuss stage different after.
493,566,Phone Call,2023-04-04 15:13:17.950091,Offer use edge under his less land quickly.
494,744,Chat,2021-02-11 03:41:04.138200,Smile same notice boy customer short.
495,988,Phone Call,2023-07-29 16:45:43.192377,Strong anything never send meet successful break tree rich.
496,825,Phone Call,2021-02-21 19:11:46.917225,Provide town debate work live white beyond building skill just.
497,599,Email,2021-03-17 17:05:23.481399,With seek while future election evidence.
498,222,Email,2023-03-17 11:22:23.001070,Around left serve candidate public show simple sport.
499,437,Meeting,2020-06-08 11:43:25.129208,Large field bank too plan hospital land house.
500,931,Meeting,2020-06-28 22:49:02.491048,Behavior nice military environmental heart live popular.
501,998,Chat,2021-02-18 21:33:21.582169,What time give dream month think seat wait.
502,993,Email,2022-05-28 17:45:51.846834,Could pull step cup run give before.
503,905,Chat,2022-12-01 13:29:10.025492,Political a student training raise site method commercial play resource us.
504,6,Phone Call,2022-02-02 09:32:25.688168,Help nothing dark national push form sense.
505,113,Chat,2023-09-17 19:30:21.913539,Interest dog responsibility plan our six at development race hotel back very medical.
506,988,Phone Call,2023-01-10 12:03:47.919067,Current dream ask nothing popular design dark.
507,785,Phone Call,2020-12-21 19:56:08.123749,The trouble phone stage size future open artist amount nothing whatever already.
508,837,Chat,2022-06-08 05:15:24.191780,Little stay store central thus finish party piece let.
509,190,Phone Call,2021-10-10 19:54:20.499373,Beautiful admit protect student language happy there the author teach start quite activity.
510,848,Chat,2022-11-05 17:59:21.314858,Age form teacher beautiful new force last media soon than both able.
511,357,Email,2020-03-18 05:39:51.932086,Fall yourself single price history bill.
512,553,Chat,2020-12-28 08:46:27.801989,Entire later never show language bag himself great own be future.
513,184,Chat,2023-07-15 09:07:24.402246,Body too stay member treat mission outside first business effort.
514,583,Meeting,2022-07-25 21:31:48.517144,Traditional spring sport nearly international local mention.
515,136,Phone Call,2020-04-09 13:02:12.617569,General back government be attention base suffer feel happen main become meeting toward.
516,114,Meeting,2024-02-25 05:10:10.225465,Left particularly very quickly total capital.
517,207,Chat,2022-12-19 07:14:27.336988,These current possible various speak result year describe area then left interview for.
518,411,Chat,2022-10-18 22:34:41.374116,Station beyond positive a shoulder cause thought unit since rather its worker.
519,543,Phone Call,2022-06-17 19:42:53.822767,Human way foot expert financial community anything nor page sort decision.
520,966,Phone Call,2020-09-01 05:21:27.625838,Technology employee eye health friend despite exactly piece concern.
521,610,Meeting,2020-05-10 08:23:50.546563,Run end class art world no news score total field but.
522,159,Chat,2022-04-09 14:01:56.525527,Ever set represent need how identify seat three total leader across state purpose.
523,948,Email,2021-12-28 11:37:37.102622,All push Congress building Mr half among section anything.
524,701,Phone Call,2021-08-25 19:59:43.035863,Industry her parent mind party including identify identify whose sell large choose red unit.
525,124,Email,2020-04-15 00:11:48.983101,Throw seem word to half million report look by fact.
526,907,Meeting,2020-04-16 02:56:38.012674,Better camera us son per consumer real deal.
527,571,Phone Call,2021-09-30 17:56:08.137523,Would against hope safe film door even author for.
528,289,Email,2024-03-19 02:34:46.932114,Report set view matter certain gun.
529,284,Phone Call,2021-05-05 00:00:07.749958,Safe west of off movie indicate forget.
530,896,Chat,2020-09-12 09:29:36.550867,Idea quality let base act century great go above.
531,646,Phone Call,2020-06-19 20:06:11.594229,Table success company step describe catch mention west garden.
532,106,Phone Call,2020-05-12 12:01:48.119660,Themselves step article story network ball yard somebody.
533,878,Email,2024-04-29 13:33:02.387869,Recently plan cost situation call world where major serious behind true take leader.
534,218,Meeting,2023-09-16 14:57:34.139556,Section draw know during brother already try military garden project newspaper international.
535,917,Phone Call,2021-05-02 12:05:36.546761,Fact recently western sit today purpose.
536,254,Meeting,2023-12-11 00:11:30.638540,Position push choose rule ability example different language despite forget parent fine.
537,539,Phone Call,2022-08-08 04:21:53.050148,Story war senior security those of.
538,721,Chat,2022-10-31 18:10:48.535219,Capital just rich agency game soon exactly produce improve night.
539,824,Email,2021-05-26 12:52:43.087659,Alone here event lose wife sing figure instead wide never science accept society.
540,82,Meeting,2023-08-08 14:46:50.079550,Draw environmental job sport one hair modern important school.
541,186,Chat,2023-07-26 22:58:13.725471,South truth direction economy like weight wide.
542,814,Meeting,2021-12-30 18:04:03.790276,Specific star find especially party able wish Mr rate industry smile.
543,528,Meeting,2020-12-21 14:20:00.798539,Significant nothing sit evening whose cultural recent three.
544,928,Email,2023-04-17 18:45:46.825730,Final wall he themselves health discussion agreement hold apply.
545,26,Phone Call,2023-10-04 00:04:08.494491,Listen member home important between southern wind wear open over when.
546,243,Phone Call,2023-03-17 08:36:33.530430,Others nor her information before couple picture rather star.
547,159,Email,2022-12-06 03:28:26.312309,Human business teacher today stay suddenly security clearly performance up candidate.
548,84,Meeting,2021-09-29 06:07:56.446691,Though least too sit act always short size miss.
549,774,Chat,2022-12-18 22:17:23.717226,Media military face wall tell few idea part there none.
550,325,Phone Call,2021-11-07 05:19:03.148777,Account black democratic development east test themselves need seem degree meet this course.
551,185,Phone Call,2023-03-21 14:58:54.936346,Only nearly area region region sing.
552,42,Meeting,2022-11-20 16:45:47.059921,Opportunity city art political show make true ago newspaper offer beyond improve.
553,14,Phone Call,2021-02-12 21:16:33.405922,Task arm probably design rich religious through thank police recent.
554,731,Email,2023-05-30 22:31:11.048893,Bank effect position both minute either race.
555,437,Chat,2021-05-27 11:45:12.440419,Should plant past goal live around official him.
556,251,Phone Call,2023-03-01 02:20:33.796122,Piece believe project final source trade commercial gas produce.
557,982,Meeting,2021-01-06 07:22:28.879711,Much really seven himself bed water place none choose.
558,480,Email,2022-11-09 01:59:04.029200,Thus minute affect you perform onto arm million center hospital provide these.
559,251,Chat,2023-11-19 10:14:29.450445,Thousand create lot general by always.
560,368,Meeting,2024-06-25 00:56:43.470845,Beautiful notice art race material step approach international forget yet despite nice field.
561,848,Meeting,2022-02-18 02:28:53.641968,Mrs something capital poor public perhaps choice.
562,422,Chat,2021-03-15 10:44:32.570800,Remember throughout available democratic example price goal wind since medical.
563,355,Chat,2023-02-22 00:15:13.635359,Result cost add interesting reality low.
564,284,Email,2021-07-27 16:06:01.704193,Reason draw issue director plant direction child decide attorney.
565,815,Phone Call,2020-08-15 12:11:58.769203,Matter religious have treat we how against quite analysis heart name.
566,701,Meeting,2024-03-12 12:27:06.178999,Read attorney leave fish head such last way system.
567,257,Email,2023-09-03 07:36:27.879876,His production identify why that street money official store sport admit.
568,692,Email,2023-12-14 01:08:50.355747,Happy those time beautiful including establish listen change in article.
569,484,Meeting,2024-07-22 15:25:45.988555,Reflect out instead soon question buy notice movie tonight age state coach.
570,623,Chat,2022-11-25 21:09:43.910059,World eye spring road north traditional.
571,149,Chat,2020-10-13 20:21:13.475401,Industry month national pay peace race season their live.
572,811,Phone Call,2021-12-04 10:25:23.132963,Though trip west popular if more home bag.
573,411,Meeting,2021-12-05 09:06:38.725837,Decision fire impact town company month.
574,666,Email,2023-05-03 08:50:44.301731,Two break skin same use sort better personal kid move.
575,824,Chat,2020-05-17 15:42:01.838066,Really garden rich up these might memory necessary.
576,675,Meeting,2024-05-21 21:57:12.229289,Billion mouth back evening any dark while building stand care body collection despite.
577,707,Meeting,2023-04-19 22:40:14.606560,Control culture issue gun assume theory suddenly soldier.
578,134,Phone Call,2023-01-13 07:07:47.347665,Road position see second measure week water tend conference maybe nor.
579,282,Phone Call,2021-03-21 20:01:45.129496,Challenge smile impact speech them many during.
580,582,Email,2020-08-08 04:18:05.445829,Investment economy street audience history church against security hair nation look.
581,4,Meeting,2021-05-19 18:14:46.456005,Item speech edge situation design help leader focus that likely.
582,996,Meeting,2022-10-24 12:54:12.320660,Top real practice since discover anyone unit strong movie safe.
583,889,Chat,2023-08-02 06:07:46.579676,Both quickly go price myself significant look whom whole.
584,385,Meeting,2020-09-20 04:08:15.417464,Worker follow when southern argue instead able.
585,665,Email,2023-05-31 23:13:49.535742,Foot say follow security other ability.
586,317,Chat,2021-11-17 22:05:57.744429,Strong free ground turn area writer writer social character start.
587,259,Chat,2022-01-20 08:16:29.502327,Whatever not because voice thing stop class avoid country newspaper kitchen here view.
588,403,Email,2020-06-30 17:54:48.465402,Hotel standard their eight in leave have clearly approach yourself including memory simply.
589,169,Meeting,2023-07-14 09:50:44.086444,Consumer share remember knowledge idea operation instead student show born oil drive company.
590,832,Chat,2024-01-09 15:59:22.739232,Whom main heart in affect window take all imagine grow street.
591,501,Chat,2023-07-25 01:55:33.394130,Agree record yes society fear ten music figure move.
592,902,Chat,2022-06-12 09:21:39.101761,Along better imagine I finally tell start interesting despite against situation himself.
593,613,Chat,2021-07-16 08:54:21.844096,List fine participant one deep leader.
594,0,Phone Call,2020-09-29 21:43:45.784782,Film network make but marriage my song way data actually.
595,813,Chat,2020-11-18 22:57:50.709070,Product significant official beyond at fly bad.
596,514,Meeting,2021-08-24 08:49:39.682328,Benefit indicate able others person Republican throughout more next tonight determine attack church.
597,108,Chat,2021-01-11 05:36:12.987761,Whether address foreign month explain once.
598,142,Phone Call,2022-09-10 11:51:47.080349,Race plant top occur alone peace lead whether interest fly over beyond particularly.
599,48,Email,2022-08-27 22:46:29.320642,On whom gun both model choice station bar.
600,834,Email,2023-10-29 02:17:54.959566,Process certain form stuff deal point different perhaps position seem receive season.
601,436,Chat,2020-01-10 13:02:15.583052,Too ball lot program safe onto seek should listen kind use.
602,402,Meeting,2023-01-25 13:26:05.445364,Thought couple relate rule manager foreign play thus natural.
603,399,Chat,2020-04-05 20:38:04.729887,Lawyer prove spring international practice person few live light air road physical.
604,881,Meeting,2024-04-03 04:58:07.007516,Tough their father set administration purpose determine ability since message.
605,338,Chat,2022-01-05 17:31:18.997818,Like local scientist care environment mind individual song herself wear much drug poor.
606,998,Phone Call,2021-06-02 09:09:08.481631,Knowledge prepare great nature hospital yeah interest law you.
607,617,Meeting,2022-06-15 15:31:13.460414,Current report then particular many miss contain themselves rule shake.
608,758,Email,2021-08-29 09:28:09.213072,Available during admit while certain recent voice white dinner.
609,474,Phone Call,2023-04-22 07:41:55.223785,Who thought home rate provide cut yet may happen early.
610,832,Meeting,2022-01-26 12:19:50.054200,Necessary hard between skin necessary bit window class little relate official study art.
611,998,Phone Call,2023-12-11 01:10:37.087968,Big study control role bit just plan important animal we.
612,302,Phone Call,2022-07-03 19:01:39.388480,Happy staff star agreement pattern customer beautiful.
613,496,Email,2022-07-01 00:36:25.785724,Social short across road data become mention health who.
614,724,Chat,2022-10-21 11:23:54.128818,Serious a create including family country meeting fire crime quality organization bar.
615,455,Meeting,2021-02-14 06:23:55.914807,Morning school hard three bag fight building detail.
616,100,Email,2021-02-23 14:28:30.133344,Sound others its save must early investment sort writer charge.
617,289,Chat,2023-07-22 06:14:53.718557,Size whether local night necessary himself concern discussion appear think half.
618,297,Email,2021-11-22 20:56:02.306745,Property front stand take lead human ever sing single might return government.
619,1,Email,2020-08-31 20:52:42.148015,Nearly impact thank much imagine take forget kid.
620,247,Meeting,2020-03-17 07:37:55.504663,Seek risk mouth lot special short avoid physical husband team fine.
621,740,Phone Call,2022-04-21 21:45:43.544420,Test color summer determine eye standard authority thus responsibility top positive cut.
622,485,Meeting,2020-09-04 16:21:50.286862,Term market war course partner at.
623,547,Phone Call,2024-07-12 04:16:53.609453,Officer perhaps case thank last less quickly like start drug century.
624,967,Email,2021-03-09 10:39:25.205140,Present decide task air either marriage explain.
625,174,Email,2023-10-14 03:16:18.070533,Quality during attention then most partner along.
626,437,Phone Call,2023-10-14 06:19:56.885697,Simple find power side law fast.
627,622,Chat,2020-06-26 15:59:39.121663,Another fund court opportunity commercial somebody evening option simply.
628,588,Meeting,2022-04-14 06:50:14.708223,Animal born face during fall phone again statement.
629,865,Phone Call,2020-03-14 01:17:44.465433,Radio allow level ok dark tend thousand third production doctor girl effort ball.
630,997,Phone Call,2021-05-25 08:25:49.709522,See listen science task owner maybe blue parent sometimes your action exist your.
631,296,Meeting,2020-12-11 20:33:09.483399,Would tend social have as energy religious boy.
632,526,Phone Call,2023-01-06 00:09:22.566419,Always social management decide identify carry learn fight knowledge guess fight impact.
633,63,Meeting,2021-06-01 08:24:20.006408,Shake a finish oil wind choice play.
634,622,Email,2022-10-26 04:32:45.273567,Test finish charge fish control southern occur husband affect modern.
635,773,Chat,2023-11-01 10:33:17.519815,Ready against top front maybe high power story.
636,972,Chat,2022-12-08 15:43:19.402698,Senior education field just sit why audience tell present will benefit everybody.
637,331,Meeting,2021-07-11 04:23:41.564372,Available single worry fact time authority man keep rest help child although.
638,801,Chat,2024-05-03 07:58:50.090647,Magazine lot model inside land anyone voice letter.
639,911,Chat,2023-01-28 20:47:42.036018,Realize dog activity chance particularly data understand.
640,995,Chat,2020-06-01 17:55:08.470687,Hospital participant lawyer reason cup issue sing thought wear star defense low exactly.
641,227,Phone Call,2021-03-29 20:03:44.893561,Southern customer summer continue spring against must article return.
642,492,Email,2020-08-06 01:55:13.269796,Different instead bring chance professional bank must laugh technology teacher.
643,304,Meeting,2023-02-15 18:55:38.449565,Material open own positive yourself kind research baby sing population.
644,572,Phone Call,2022-09-29 02:22:35.963924,Control hospital however check avoid or end but economic parent nearly TV.
645,154,Meeting,2022-10-07 03:01:06.095126,Realize size recently past vote performance plan few you every two left us.
646,332,Email,2020-04-06 19:57:13.852834,Property along support huge teacher light language resource.
647,276,Meeting,2024-01-23 14:04:47.346217,Hotel ability city official star conference there young second share material quality issue recent.
648,199,Meeting,2020-12-16 22:37:31.734906,Eat experience hear class specific card.
649,438,Email,2021-08-30 07:17:34.659770,Audience lay poor try store state economic box institution small wind.
650,984,Meeting,2023-02-25 14:02:57.193400,Action work audience choice issue common car new find will southern exist.
651,350,Email,2020-09-06 23:24:06.938166,Majority page run single firm huge lose security brother name soon my.
652,380,Email,2023-07-26 15:19:05.648308,Positive ever clear parent everything over including.
653,513,Phone Call,2022-07-05 23:44:37.341879,Age rather usually line similar respond keep my.
654,703,Chat,2024-02-27 16:26:38.619239,Visit already religious data top opportunity build young law dog.
655,92,Email,2024-02-15 18:50:38.033099,Rock skill stock international couple ten could nice about.
656,292,Email,2021-10-18 11:42:08.261143,During senior write bill try determine real wait.
657,263,Chat,2022-03-28 01:23:37.612949,Else doctor look situation successful election.
658,426,Email,2022-06-25 07:22:34.517141,Conference throw entire pass glass pull word blood room candidate there take.
659,384,Chat,2023-05-08 20:50:23.610772,However few while as least lose.
660,112,Phone Call,2023-11-19 00:14:26.730730,Performance white mission upon court guy research product.
661,960,Chat,2023-06-12 12:30:04.009864,Feel sound or admit show smile prepare number radio stay far seven girl.
662,651,Meeting,2020-04-08 21:19:28.386975,Thousand doctor coach north behind protect last where himself analysis ten.
663,713,Email,2021-03-18 09:30:47.529890,Who miss last your kitchen born whatever idea.
664,313,Email,2022-01-05 14:07:31.679547,Tough difficult task pretty us purpose usually program near.
665,823,Email,2024-03-14 01:43:11.022070,Fill fill then student third rock other with tough memory.
666,143,Meeting,2023-03-13 00:10:38.029603,Could note happen instead chair piece federal usually produce.
667,602,Phone Call,2021-01-03 22:11:06.615038,North your later point hotel science art woman nature mind may film.
668,220,Phone Call,2021-03-21 18:05:51.344802,Front factor police specific stock air hand deal even culture huge.
669,515,Email,2023-03-25 16:32:19.326452,Will nearly may garden go manager find experience.
670,413,Phone Call,2021-08-04 12:51:58.864828,Rate professional line report movement provide let both.
671,23,Meeting,2020-01-22 15:34:27.681038,Art everybody another age consumer different trade shoulder direction city huge.
672,127,Phone Call,2022-03-10 08:33:55.675107,Security whole mention summer message thought north same next approach.
673,842,Email,2021-02-27 10:11:49.923812,Their movie reveal bad suddenly reveal money although up.
674,266,Chat,2020-04-09 14:18:23.348645,Out weight admit stock agreement once money guess structure action second.
675,50,Chat,2020-12-16 17:44:12.715860,Teach name movie support beat possible indicate.
676,625,Meeting,2020-10-10 03:10:06.748337,Assume politics attention popular everything bag bag need down citizen coach.
677,527,Chat,2022-01-24 19:44:48.852186,Production feeling your different age read bag remember.
678,838,Email,2022-08-24 14:03:47.768411,Wish western stock perform television green before quality my provide land minute.
679,603,Phone Call,2021-08-11 11:05:33.555269,Woman relate feeling individual Democrat bed pass level.
680,563,Phone Call,2023-03-24 15:57:42.273911,Sing politics stage well budget major.
681,373,Meeting,2023-08-19 02:56:56.643446,Particular paper order course major whole type real increase president local less.
682,258,Chat,2021-06-16 03:07:26.008142,Might manage think rate provide state national board.
683,917,Meeting,2023-01-18 15:47:12.432944,Drive example together increase growth trade to single ten bill million write actually.
684,322,Email,2022-08-08 22:39:44.729689,Buy beautiful simple design tree put enter recently voice pattern several Congress matter.
685,198,Meeting,2022-09-11 01:09:25.700131,Allow her measure why establish sign base sport policy hour little only.
686,53,Meeting,2021-08-01 20:36:49.230933,Note street pattern pull think fund left process medical all.
687,181,Chat,2021-11-11 04:44:06.103091,Business yard like recent still large throw tend scientist.
688,966,Email,2021-01-13 20:35:44.224981,Adult expect party sport month too receive station third beyond.
689,449,Meeting,2020-10-01 12:10:02.770665,Mean capital tell ground huge wonder.
690,474,Email,2022-07-10 10:39:16.344590,Budget six live raise between wife agree.
691,67,Meeting,2022-06-11 21:02:15.515177,Institution Mr system suddenly floor lot.
692,150,Phone Call,2024-02-28 19:42:24.646087,Rather rich space discussion behind kid line.
693,59,Email,2020-12-02 00:46:25.723948,Rather avoid country trade seat note.
694,455,Chat,2022-01-04 03:50:54.983166,Today camera beyond yes thus nation cover situation design yet turn choose lot.
695,156,Email,2021-04-21 17:44:17.739797,Let concern become amount send if benefit science sport particular or eight become.
696,908,Email,2021-02-13 13:07:28.646771,Weight person soon truth around benefit identify person wall.
697,626,Phone Call,2023-09-03 22:37:50.210004,Body political side them most five same whether other land form choose spring.
698,647,Meeting,2021-04-03 04:10:35.575861,Blood take style both nice way key.
699,312,Chat,2024-01-04 15:43:36.277066,Begin fear bad sea senior like school.
700,379,Email,2020-07-18 22:39:53.422575,A do argue anyone themselves town television yet rest from measure.
701,125,Meeting,2021-05-08 01:20:09.976937,Finally guy to imagine bank enjoy anyone generation forward financial.
702,391,Email,2022-04-15 20:50:14.660200,Exist health either yard sort stock.
703,99,Meeting,2023-09-17 02:47:01.403006,Land step girl yourself news sea agree receive hand.
704,183,Chat,2021-11-20 08:06:00.213043,Former large example clear kid professor imagine design its draw able.
705,221,Email,2020-07-14 03:11:58.875113,Church cell race light now game and mother detail feeling run many type.
706,379,Chat,2024-01-19 01:13:41.773646,Treatment career necessary become serious increase.
707,192,Chat,2023-01-16 18:17:45.787696,Finally under world trial body get.
708,867,Meeting,2021-10-31 19:10:44.299848,Character until author offer interview receive out mean drug hour able technology.
709,139,Meeting,2022-06-29 20:25:20.793414,Allow trade spring cultural claim painting hospital hope word.
710,955,Meeting,2020-05-25 02:59:42.883748,Hot tough answer no under student attack phone husband team human.
711,412,Phone Call,2022-06-04 11:08:21.188307,Together offer arrive identify attention buy better only Mrs country seek pattern it.
712,928,Meeting,2020-04-16 20:39:05.132900,Democrat policy resource whether box voice purpose sign try.
713,427,Chat,2023-12-04 23:06:50.053444,Within Congress center plant defense way Republican.
714,948,Chat,2022-05-23 19:54:40.960678,Dinner kid part treatment personal writer strategy.
715,708,Meeting,2024-05-18 12:23:42.812785,Wrong hit more view affect recently fight.
716,264,Phone Call,2020-12-10 11:56:45.052158,Author sure design once fine music maintain level since painting drop.
717,362,Meeting,2023-11-28 07:53:29.023615,Decade democratic course how score performance particular education establish executive language carry.
718,608,Chat,2021-05-07 13:13:16.781713,Industry stand space six why responsibility.
719,293,Meeting,2022-12-30 12:34:22.445494,Again of appear brother travel effort law fly maintain us with computer.
720,944,Email,2023-03-12 16:24:02.318396,Able leg about customer person record identify cut space.
721,709,Phone Call,2020-10-07 05:35:53.747970,Financial authority according bar return wall for window.
722,713,Chat,2021-03-29 07:55:54.368036,American opportunity determine because policy stage treat establish recently data line with American.
723,264,Chat,2023-04-04 09:18:42.338498,Quite follow throughout exist him manage structure social ever as recognize hope else.
724,660,Meeting,2022-05-27 14:42:06.994089,Hard guess make inside high message season population particularly physical level.
