interaction_id,customer_id,interaction_type,interaction_date,notes
0,919,Meeting,2022-10-14 12:58:22.779852,Soldier five knowledge watch defense indeed quite until.
1,503,Phone Call,2022-02-21 21:05:52.769067,Trouble well themselves job represent create health manager toward newspaper hard.
2,765,Chat,2022-05-19 03:08:52.624605,I source dark spend general hold down picture character throughout rise use.
3,217,Meeting,2023-11-07 03:43:21.448466,Test piece prove customer recent language.
4,857,Meeting,2022-11-12 04:14:28.409571,All give teacher drive party behind news.
5,23,Email,2023-02-18 08:31:02.435616,Window how difficult very candidate amount oil.
6,438,Email,2022-05-30 03:14:04.176451,Here ready gun food let policy about.
7,157,Meeting,2021-01-11 23:09:55.396625,Ever with commercial meet shake choose.
8,328,Phone Call,2020-11-06 00:45:00.284044,Break human task able outside none fast worry growth dog key.
9,5,Email,2024-02-28 07:42:33.346916,Quality amount common laugh consider information.
10,63,Email,2024-03-08 00:18:10.636291,Information authority interview behavior network kind imagine enough amount nearly.
11,438,Chat,2024-06-02 22:54:09.298169,Opportunity Democrat series support tax group season small member explain.
12,707,Phone Call,2023-01-11 22:18:06.650260,Wish answer church yes seem everyone very man.
13,145,Email,2020-12-05 03:13:04.565955,Sense play describe measure price run tree she technology common bar level water.
14,939,Email,2023-08-10 17:06:27.311756,Some resource idea serve end sure record appear charge.
15,63,Email,2021-07-18 18:35:34.397328,Field cell debate Republican through color return serve year government century pattern.
16,140,Meeting,2020-08-31 07:19:57.109555,Sit continue green arm this heart level prove event almost.
17,353,Phone Call,2023-01-16 15:21:14.074567,Mr brother hard year seem down concern himself certain contain keep white believe.
18,889,Phone Call,2023-03-22 02:57:09.980621,Inside move open among again information audience lot.
19,682,Chat,2024-07-12 17:08:27.745235,Base drug team well amount line.
20,637,Phone Call,2020-09-01 01:13:19.535362,Campaign bag hot anyone watch thought.
21,549,Email,2024-07-19 16:40:35.796932,National social fly thus case send wear star their able we foreign.
22,943,Chat,2022-02-16 14:22:52.356574,Local card effort whom nice final floor cost.
23,352,Meeting,2021-05-27 00:37:31.195985,Statement term choose sport all talk focus according continue research tend former.
24,484,Meeting,2020-07-18 15:46:37.084038,Heavy really science help it yes at memory central individual one certainly.
25,26,Meeting,2021-09-23 14:44:25.806418,Job improve rate state election kitchen learn.
26,918,Meeting,2020-09-25 19:01:36.959615,Final easy course poor always list begin.
27,660,Chat,2020-09-28 03:25:13.946097,Ability few power ready deep nearly.
28,548,Chat,2021-03-31 21:56:31.861996,Sing near past challenge above this main citizen radio quality age outside nation.
29,481,Meeting,2023-06-29 13:12:56.837224,Happen issue be her open nearly allow then dog some form hospital.
30,747,Phone Call,2020-09-06 20:08:33.817726,Strong drop reflect smile anyone treat best.
31,514,Meeting,2020-03-05 06:57:33.678845,Environment easy result debate dinner opportunity plant.
32,187,Phone Call,2022-09-07 09:12:24.164963,Bed east become his positive short skin above relationship course end.
33,652,Meeting,2021-11-28 14:14:22.639260,Budget may plan eye special quite reduce.
34,611,Chat,2020-01-27 08:47:19.423431,Stuff total back church tonight five realize.
35,176,Chat,2022-11-09 06:53:00.142719,Learn live world product serve blood mention own.
36,176,Email,2021-02-23 08:35:50.127226,Generation entire party water during art time well raise style look once you.
37,258,Email,2020-01-18 08:48:23.187798,Treatment capital film worker throw carry have enjoy movie.
38,125,Phone Call,2020-09-30 03:07:04.026145,Born part often job win player recent man for material prepare though.
39,852,Chat,2024-04-14 23:41:29.405737,Car poor whose firm talk hit win her we.
40,864,Phone Call,2022-03-30 16:44:42.640954,Really onto hundred factor report experience part reflect task bar commercial body.
41,173,Email,2022-03-31 11:11:51.570438,Machine much name study heart according serve range out.
42,436,Meeting,2023-12-23 11:00:09.071277,Focus police could employee story fact something language ahead home set project investment.
43,470,Email,2024-06-23 17:14:25.499963,Force home nor class think candidate hard whom still community kid resource.
44,587,Chat,2022-04-29 18:06:31.603876,Political away daughter agreement prove open wide make.
45,509,Phone Call,2021-09-29 16:14:48.037127,Within doctor message get how eye town me edge allow.
46,304,Meeting,2023-03-22 03:24:43.254645,Energy thank institution hold mention discover carry event.
47,515,Email,2024-05-10 14:09:59.728968,Whether improve call half admit growth college.
48,803,Meeting,2022-04-18 01:02:34.204233,Either likely best kitchen network bar voice.
49,289,Email,2021-08-25 21:04:14.594783,Night question TV various coach as require author hold worry run.
50,906,Meeting,2020-06-24 20:59:06.811099,Drive them idea radio left feel health compare before service modern.
51,280,Chat,2020-03-10 17:49:45.713528,Production rate think whether cover Democrat quality public stand its.
52,673,Chat,2020-07-03 10:24:01.573512,Specific everyone event half whatever resource prove magazine full almost institution expert here.
53,47,Email,2021-04-19 12:25:40.975574,Born ten democratic war old may market above.
54,36,Chat,2022-10-12 04:03:18.584443,Seven collection for meeting white carry herself above very why Republican technology grow.
55,970,Meeting,2022-04-22 17:07:17.904974,Especially rest view name land tax southern religious responsibility.
56,391,Phone Call,2023-09-19 18:17:40.489684,Itself cold protect same fill student police at.
57,181,Chat,2021-10-27 03:08:19.838564,Four bar week mention person character level bag yes road simple.
58,709,Phone Call,2021-03-12 19:19:29.715397,Point reflect prove evening at deep camera simple large just get full reveal.
59,960,Meeting,2022-08-15 02:28:28.402601,Girl produce federal low foreign week stage may close almost quite a.
60,902,Email,2020-10-15 10:15:28.568480,Protect social end family before try field three list hotel.
61,19,Email,2023-11-30 23:06:33.771992,Both sign number physical home company weight rule official.
62,383,Chat,2022-05-11 09:44:44.683834,The property first need a war doctor firm trial develop office relate.
63,471,Phone Call,2021-10-11 06:29:40.044964,Determine Republican tax official once key military.
64,765,Email,2023-10-29 16:06:32.853968,Carry under her explain medical ask build dark reflect whole significant.
65,451,Chat,2021-11-07 12:40:58.093628,Home note determine particularly never explain others avoid.
66,6,Phone Call,2023-05-20 02:16:18.131576,Fund suddenly light ground manager above present personal available.
67,106,Email,2021-09-04 18:39:55.637145,Another this industry nor help sport always.
68,197,Phone Call,2023-08-24 19:04:04.283946,His personal program without section beautiful fine but.
69,112,Email,2021-09-18 03:02:38.718977,Their act president organization institution positive half technology west view travel any.
70,290,Chat,2024-04-08 10:09:22.683793,Ball they artist seven work price bag why he.
71,780,Phone Call,2023-10-31 03:59:48.224260,Program shake sport green style own from stuff strong realize.
72,312,Meeting,2023-09-28 17:18:07.557050,Continue tough lose focus these true statement American thought.
73,658,Email,2022-08-17 19:13:16.972541,Discussion wind parent serious several away how medical executive.
74,526,Meeting,2021-04-10 23:55:12.064123,Purpose run author knowledge talk carry everything rise need by around adult again.
75,272,Meeting,2023-12-18 17:49:33.615668,Wonder effect season south federal anything half idea.
76,921,Phone Call,2020-10-29 20:59:42.874098,Marriage point news social century show small.
77,932,Email,2022-02-11 18:35:33.440390,Grow family hour those result become me.
78,654,Meeting,2021-11-09 05:35:10.884167,Strategy important how government talk method believe notice against your early.
79,17,Phone Call,2023-07-17 16:19:02.903492,Share site side necessary author protect old which name.
80,150,Email,2023-08-28 18:52:15.834433,Benefit material figure kitchen front about remember sell.
81,399,Chat,2024-04-23 13:53:28.999939,Own each nor hot while military throw hand interesting once.
82,421,Email,2020-06-21 18:05:41.324949,Picture central because floor song provide its finish factor no major glass art.
83,678,Phone Call,2021-12-03 19:42:25.591727,If respond poor result part actually simply smile.
84,671,Meeting,2023-01-11 02:50:39.940666,Society case place music edge affect finally.
85,751,Phone Call,2022-08-16 23:12:20.414754,Reality son leader he before everything.
86,206,Meeting,2023-09-23 01:01:31.544230,Religious modern owner economic high mouth Democrat expect early anything find us.
87,362,Chat,2024-04-26 04:50:19.080966,Glass less white everyone between pick certainly.
88,530,Phone Call,2021-04-07 19:43:13.791942,Research or city lay fund night street.
89,862,Chat,2022-12-26 06:28:19.848090,Son next say music decide black.
90,241,Phone Call,2021-02-03 03:14:49.299515,Third international raise owner financial data note cultural change doctor rock probably.
91,548,Meeting,2023-01-18 22:01:37.465622,Maybe guy beautiful moment finally several we three debate notice.
92,831,Phone Call,2023-10-19 10:04:14.350793,Must until center everybody improve drug concern performance factor administration check half.
93,626,Email,2022-08-05 13:44:39.597219,Activity individual loss art likely black return style president run tax back.
94,744,Email,2020-11-14 23:07:55.591186,Meeting discuss language camera candidate sell entire.
95,717,Email,2020-07-29 14:09:04.355771,Decide raise little imagine several reduce.
96,831,Email,2022-12-28 01:32:17.096716,Service president nice boy camera just fall bad it cover.
97,584,Chat,2021-01-10 19:13:07.867185,Including animal reduce official garden someone clearly cut will fire follow.
98,327,Email,2020-04-28 12:25:14.660496,Finally suddenly resource or simple form produce ok know now collection even now.
99,586,Email,2021-11-19 01:19:55.844380,Put poor produce job run mind from weight would note realize save successful.
100,381,Chat,2021-09-16 06:17:39.320096,Stock hour here imagine husband direction in partner.
101,67,Email,2023-07-24 19:07:21.163047,Travel style scene personal despite within middle senior green face now enter can.
102,396,Email,2021-02-20 09:06:43.663516,Science military various major subject political protect cut red drug theory.
103,261,Meeting,2022-01-21 13:23:03.032758,Property down treatment reality most enough level save behind cultural former son.
104,311,Meeting,2023-12-11 15:33:41.882468,Tell decide off painting new ability agree build character I bar president.
105,633,Phone Call,2022-12-28 09:22:27.909082,Figure operation economic meeting difference local talk save happen condition.
106,716,Phone Call,2022-01-26 14:00:40.296111,Talk look discussion subject carry down young leader call method similar thought.
107,946,Meeting,2022-01-30 21:12:23.160208,Effort bill style moment five federal attack feeling available same support huge investment.
108,408,Chat,2020-05-01 01:05:23.929422,Available behavior position service world rather chance business there.
109,256,Meeting,2020-12-12 19:36:40.741993,Pick discussion small soldier baby positive forget section community third plant.
110,627,Phone Call,2022-08-01 21:29:08.399873,Do mind situation night sign knowledge.
111,306,Meeting,2021-02-01 09:34:26.392365,Power financial glass through laugh growth TV financial trip physical.
112,338,Chat,2024-02-21 21:05:36.079528,Cover after play cause purpose five international program than.
113,895,Phone Call,2022-09-19 20:27:01.872754,A central oil west north month gas my way class marriage.
114,903,Email,2021-04-02 10:07:27.910080,Step challenge three specific we value address around rise now.
115,57,Email,2020-03-09 07:04:23.747293,Near floor series bag key nothing help modern.
116,747,Chat,2022-11-23 20:51:42.129401,Age into phone develop growth maintain official police amount alone kitchen.
117,527,Meeting,2020-04-16 04:48:40.344569,Force begin pick would above of establish.
118,604,Chat,2021-02-07 12:30:11.151575,Election case thus around remain forward get will dark though individual.
119,68,Phone Call,2022-11-08 09:51:40.233211,Cell feel effect organization help down customer natural truth would avoid through.
120,778,Phone Call,2022-05-22 01:15:47.257247,Choice buy marriage hair rise spring campaign claim somebody require him likely now.
121,254,Email,2022-10-20 19:18:08.172547,Remain pretty yet herself threat add listen positive business assume off.
122,396,Chat,2022-07-08 09:24:26.664361,Identify go five focus great chair young debate accept behind road fear able.
123,955,Meeting,2024-04-25 03:13:02.070771,Special current commercial keep because magazine walk start across Democrat war.
124,734,Meeting,2021-04-23 17:27:02.110613,View wish but assume forward hair if agree my popular.
125,466,Phone Call,2024-06-17 18:24:01.111670,Tax sort cover all stage through way happy paper before color walk third during.
126,84,Chat,2023-09-20 15:00:31.449464,Face best would good yourself official science include answer.
127,550,Chat,2022-06-25 00:02:36.004246,Say bad reality sign he her many dream edge continue both pass real.
128,488,Email,2021-02-04 16:07:22.487654,Step debate none dark spring from put despite benefit.
129,857,Email,2021-12-20 10:55:27.874060,Newspaper year eat all amount he none visit hour.
130,269,Chat,2022-01-24 13:25:31.469686,Admit eye wall just true question maintain positive scientist result.
131,186,Phone Call,2022-04-07 00:19:26.464790,Budget forward war nation always institution easy perform new.
132,74,Email,2020-10-23 23:10:02.366908,Present officer care cause sound your some mean later air.
133,598,Chat,2024-01-07 20:02:02.699489,Along which major democratic local myself coach both just challenge.
134,637,Email,2022-12-08 04:50:13.666608,Leg rule quite feel challenge coach audience store meeting.
135,563,Meeting,2020-03-27 19:44:49.356371,At significant it member wall really prepare so right work hot learn buy.
136,31,Chat,2020-02-15 01:56:36.940295,Fight important deep true bit toward country two Mr around event.
137,729,Email,2022-04-17 20:19:26.502310,Property break lot onto camera various move order member know image majority.
138,342,Email,2023-08-03 09:53:16.274207,Science politics why amount apply recently among officer civil yourself become best that.
139,670,Chat,2021-02-18 23:30:40.386945,Source customer finally management worker street recent.
140,577,Chat,2021-10-26 12:52:15.635082,Despite pretty wide choice low area brother dinner business letter show.
141,736,Email,2022-10-06 22:31:25.595906,Challenge toward down dream trade water.
142,950,Email,2020-06-23 18:39:58.978041,Allow election public produce class take across religious shake affect some beautiful size.
143,117,Chat,2024-04-07 23:19:29.439072,Career lose similar both house get home line nor.
144,510,Meeting,2020-04-24 01:34:07.835947,Mr sea I mind think admit blue memory or possible key save always.
145,385,Chat,2022-06-07 13:53:34.258566,Human task authority method perhaps second sometimes yet sound director challenge impact where case.
146,918,Email,2022-02-10 21:57:27.326696,Walk probably fire response begin difficult deal.
147,135,Email,2020-03-13 17:37:37.029794,Question western same live call benefit gun inside sit imagine always.
148,607,Email,2020-02-25 18:08:25.207278,Probably herself test however growth treatment development film foreign position special.
149,915,Chat,2022-11-30 05:57:42.890553,Save no thought heart Democrat your difference defense sound other total add.
150,79,Email,2021-09-20 14:06:56.599036,Appear season team last add whole parent seat.
151,707,Phone Call,2022-09-25 20:18:25.834548,Help fine care address hand toward former serious.
152,441,Meeting,2023-11-24 15:13:06.323488,Finish government challenge clear sit they themselves candidate between design.
153,373,Phone Call,2020-04-03 09:00:07.012585,Or yes surface leg former defense despite brother authority someone outside bill.
154,918,Meeting,2024-05-10 04:55:37.625310,Ability partner happy national attorney teacher wear support trip animal today stock Congress.
155,973,Email,2022-12-10 15:35:07.044110,Laugh wonder pull left visit plant per organization game.
156,398,Chat,2022-10-27 19:24:27.926321,Analysis employee traditional deal offer return seem.
157,814,Email,2023-05-06 01:34:47.131910,Pressure collection cell interview operation space information million case put.
158,267,Email,2020-06-25 07:53:27.522178,Budget cover music federal key direction century another standard position.
159,210,Email,2021-02-14 23:32:33.905414,Type kid parent there people watch hope thousand eight.
160,342,Meeting,2021-08-30 11:30:49.332201,Later alone lead pull sound west physical key American.
161,290,Chat,2023-02-13 20:44:40.119472,Agent ever offer force group clear discover couple somebody move.
162,196,Meeting,2020-04-23 11:17:29.115532,Hour look others lose must its friend.
163,518,Email,2024-06-05 11:46:51.363183,Agree land position everyone wind democratic that difference us also cell structure spend.
164,216,Meeting,2021-10-27 20:09:52.647389,Often throw such add artist opportunity democratic star American.
165,911,Chat,2023-11-28 04:12:56.282526,Rest generation color pick but range answer.
166,442,Email,2022-05-21 20:37:00.065454,Structure own bit feeling hospital structure.
167,153,Chat,2022-02-10 00:19:35.854634,Ability him specific institution talk build list eight consider next single bank base.
168,912,Chat,2021-04-07 17:21:51.466111,Player race school game agent court important money begin little.
169,965,Chat,2021-06-14 14:39:19.658735,Free plan president talk project somebody technology eat by.
170,911,Meeting,2024-02-27 14:21:25.237806,Industry research body him fast recognize.
171,39,Email,2021-03-26 07:00:32.167483,Move family center those character I director well always little million.
172,72,Chat,2023-08-01 13:30:13.661774,Play how do draw figure pass sea laugh similar boy son.
173,103,Email,2024-04-22 00:26:10.947644,Job even strategy size Democrat civil leg final beyond our year development.
174,920,Phone Call,2022-05-21 15:53:34.838727,Onto lose yes move play forget popular professor use treat.
175,177,Email,2021-07-07 03:18:10.569050,Run less wonder serious television rise along church activity president.
176,488,Email,2022-03-10 02:09:12.377034,Present along PM me agreement step professor report but story sure actually sense.
177,130,Meeting,2022-07-27 13:06:11.660395,Travel a show smile environment word.
178,829,Phone Call,2023-02-02 01:14:47.141394,Call determine man way enjoy during pretty some have husband guess detail.
179,385,Phone Call,2023-12-22 20:05:07.971754,Article plan offer scientist require piece adult mother view another series thing city apply.
180,444,Meeting,2023-01-01 23:05:01.947859,Best town popular kind reveal Congress side consumer necessary defense.
181,282,Phone Call,2024-05-31 03:37:37.037137,Pull sister response participant future fish perform.
182,92,Meeting,2021-02-04 08:24:54.757453,Meeting care she Mr class network want hospital across enough degree.
183,592,Meeting,2022-02-27 15:19:18.301192,Section stage ready hair property finish nor but friend them author season.
184,954,Chat,2024-05-04 21:10:05.514772,Store skin someone culture month also sense affect treat his.
185,226,Phone Call,2024-04-19 10:02:13.015389,Value firm heart mission environment hard at the south condition technology born party month.
186,261,Chat,2022-12-28 12:01:27.198829,Speak town low organization stuff who response our body whether.
187,580,Chat,2022-05-27 05:58:52.910858,Brother turn seek serious wish piece ball TV present low what.
188,966,Meeting,2020-01-06 23:16:59.171244,Notice two natural dark just building eye management finally technology husband next process.
189,425,Phone Call,2022-02-08 18:17:52.477213,Affect prepare name possible and large drop since chance first against theory.
190,965,Chat,2023-07-27 03:15:55.507850,Approach general media whose deal couple official vote history.
191,385,Meeting,2023-04-26 13:19:41.691096,Though common will sound back third.
192,889,Chat,2022-04-08 17:32:46.576795,Administration activity daughter population power he ball heavy newspaper wait.
193,951,Email,2022-10-08 13:56:22.713554,Term leg determine heavy just open.
194,389,Phone Call,2023-10-06 05:32:25.005763,Lose true reflect management involve head energy sometimes city.
195,490,Phone Call,2023-08-27 13:21:23.631288,Traditional couple factor billion lay big tonight everybody.
196,528,Phone Call,2023-02-27 05:32:57.906658,Girl behavior piece indicate live way where everyone trial tree radio determine.
197,513,Chat,2023-08-12 08:22:51.525196,Subject fear throughout single night break growth newspaper power write clear country show.
198,698,Meeting,2020-01-06 18:50:06.176847,Development skill station know follow together might collection cup.
199,181,Meeting,2020-05-08 14:29:01.487698,Same teach perform product bank son although teacher piece TV international.
200,721,Chat,2020-09-25 21:00:56.014005,Western oil writer nor wear action light low drop lay many grow parent.
201,933,Meeting,2024-05-09 04:10:47.857503,Professor main discover interesting might final.
202,487,Phone Call,2022-11-14 14:50:19.698738,Reflect feeling force police lose director hit trouble mind hear best newspaper would.
203,706,Email,2022-12-11 01:45:28.456543,Top will spend develop step daughter manage very want could school various.
204,949,Chat,2024-02-14 15:02:08.665423,Forward hospital thousand culture under religious event.
205,354,Chat,2021-05-09 19:10:17.866623,Water land certainly popular rate morning research young thus.
206,727,Chat,2024-03-24 19:30:31.951290,Eat probably partner decision these bad.
207,609,Meeting,2023-04-29 22:45:01.254271,Side girl we safe without could century computer treatment population news.
208,815,Phone Call,2023-10-06 02:21:33.754027,Congress mention deep century language miss often discussion fast that.
209,149,Chat,2021-04-03 02:23:11.553648,Interview quite doctor director claim wind to audience tree window amount.
210,224,Chat,2021-01-07 07:02:54.399650,First home still series keep number reason reduce year return skin center.
211,257,Email,2021-01-11 21:49:05.998595,Billion future into approach laugh a.
212,890,Meeting,2022-07-20 18:39:06.838747,Particularly participant relationship either about production provide yourself history behavior.
213,286,Meeting,2024-01-01 11:06:15.063091,Similar weight write yourself gun until investment.
214,346,Email,2023-10-02 20:56:47.911505,Record book address single rule no my kitchen never.
215,414,Email,2022-05-31 10:09:26.119568,Not himself message issue son product anyone every firm sound deal region.
216,653,Meeting,2024-05-07 06:04:30.444077,Him listen on friend choice seat break age.
217,586,Meeting,2022-12-02 18:33:59.154550,Wall world newspaper society by way so successful.
218,90,Chat,2020-10-25 10:29:01.228675,Artist and thousand memory together already.
219,510,Chat,2023-07-26 13:12:01.744385,Truth line food just let decade east effort exactly.
220,517,Phone Call,2022-04-24 08:19:41.302380,Adult decide break take series major all smile.
221,580,Chat,2024-01-27 10:32:23.789373,If never protect notice human feel close drug learn time expect.
222,929,Chat,2022-11-11 12:35:21.489473,Have or owner discover score much serious now article.
223,177,Chat,2022-07-27 15:41:05.838770,Between mean protect either table though perhaps shake real heavy student per people.
224,649,Email,2024-01-11 11:42:00.549139,Guess same address partner four small.
225,698,Phone Call,2020-01-07 21:17:46.792026,Child wear wall better pick environment commercial point friend star hair enter.
226,629,Phone Call,2020-01-17 09:58:35.229785,Leave score continue tonight national term.
227,82,Meeting,2020-01-03 10:49:09.707660,Hear in use investment question gun.
228,659,Phone Call,2024-06-18 03:56:14.321697,Summer side clearly stuff apply girl oil edge position strong.
229,687,Email,2023-02-08 02:03:57.640137,Popular child claim people popular protect fight customer project.
230,406,Phone Call,2023-08-06 19:04:11.386631,Respond what economy certainly sense store easy campaign use stop newspaper her.
231,211,Phone Call,2020-10-24 23:14:23.122138,Wonder call save join all under gun necessary quality side position phone.
232,219,Email,2020-07-29 14:27:31.500209,Small information food never seek smile million benefit respond term its computer.
233,294,Phone Call,2023-12-11 17:25:47.759947,Tough my later marriage partner score whatever.
234,386,Meeting,2021-10-20 12:44:41.492050,Past unit artist past somebody attorney sense hundred.
235,243,Email,2024-05-23 07:08:05.314151,Certain feel modern job Democrat gun way dog about agent tough.
236,850,Chat,2020-07-19 14:32:14.698487,Maybe speak social seat school lot just seat myself six final.
237,489,Meeting,2020-11-09 14:13:10.415493,Create rule traditional wish test red husband something nature group.
238,962,Chat,2024-06-12 17:13:21.321224,Require something case husband important north manager once I political data pull improve.
239,503,Meeting,2021-10-09 09:49:46.616013,Size note each reason within no.
